{
  "schema": "inkblade-probe-template-v1",
  "key": "aigateway-upstream-key-exfil",
  "version": "1.0.0",
  "meta": {
    "name": {
      "zh": "AI 网关上游 provider key 外泄",
      "en": "AI Gateway Upstream Provider Key Exfiltration"
    },
    "series": "窃取与数据泄露",
    "min_level": "利用验证",
    "writes": false,
    "requires": [],
    "surfaces": [],
    "cves": [],
    "fidelity": "reduced"
  },
  "inputs": {
    "target": {
      "from": "params.target",
      "required": true,
      "description": "Target base URL"
    }
  },
  "defaults": {
    "timeout_ms": 8000,
    "tls_verify": false
  },
  "steps": [
    {
      "id": "surface",
      "op": "http",
      "method": "GET",
      "url": "{{input.target}}/healthz",
      "save": "surface",
      "allow_failure": true,
      "timeout_ms": 8000
    },
    {
      "id": "probe1",
      "op": "http",
      "method": "GET",
      "url": "{{input.target}}/config",
      "headers": {},
      "save": "probe1",
      "allow_failure": true,
      "timeout_ms": 8000
    }
  ],
  "checks": [
    {
      "id": "surface-reachable",
      "when": "steps.surface.status != null",
      "message": "target did not answer the surface probe"
    }
  ],
  "findings": [
    {
      "id": "f1",
      "when": "steps.probe1.status == 200 or steps.probe1.status == 201",
      "sev": "critical",
      "title": "AI 网关上游 provider key 明文外泄：{len(found)} 个 provider 凭据可读",
      "detail": "Declarative probe assertion (baseline migrated from the module rule).",
      "evidence": "{{steps.probe1.status}}",
      "mapping": "docs/AI-GATEWAY.md 第 2-4 节：配置面凭据外泄与掩码留证",
      "fix": ""
    }
  ],
  "artifacts": [
    {
      "name": "aigateway-upstream-key-exfil-probe.json",
      "from": "steps",
      "kind": "json"
    }
  ],
  "payloads": {
    "benign": {
      "marker": "INKBLADE-BENIGN",
      "note": "no exploit payload"
    }
  },
  "limits": {
    "timeout_ms": 60000,
    "max_http_requests": 64
  }
}
