{
  "schema": "inkblade-probe-template-v1",
  "key": "gpu-network-operator-posture",
  "version": "1.0.0",
  "meta": {
    "name": {
      "zh": "GPU 与网络 Operator 权限姿态",
      "en": "GPU and Network Operator Posture"
    },
    "series": "网络架构",
    "min_level": "只读侦察",
    "writes": false,
    "requires": [],
    "surfaces": [],
    "cves": [],
    "fidelity": "reduced"
  },
  "inputs": {
    "snapshot": {
      "from": "params.snapshot",
      "required": true,
      "description": "Collected snapshot / fixture path"
    }
  },
  "defaults": {
    "timeout_ms": 8000,
    "tls_verify": false
  },
  "steps": [
    {
      "id": "snapshot",
      "op": "fs",
      "action": "read",
      "path": "{{input.snapshot}}",
      "json": true,
      "save": "snapshot",
      "allow_failure": false
    }
  ],
  "checks": [
    {
      "id": "snapshot-readable",
      "when": "steps.snapshot.ok == true",
      "fatal": true,
      "message": "snapshot is not readable JSON"
    }
  ],
  "findings": [
    {
      "id": "f1",
      "when": "steps.snapshot.exists == true",
      "sev": "high",
      "title": "Operator 组件特权 + 宿主挂载：{comp_name}",
      "detail": "Declarative probe assertion (baseline migrated from the module rule).",
      "evidence": "{{steps.snapshot.path}}",
      "mapping": "spec 5.2 网络架构模块 + 5.6 主机网络层；组合签名 hardware-route-privileged-posture / nvl-dra-imex-domain",
      "fix": ""
    },
    {
      "id": "f2",
      "when": "steps.snapshot.exists == true",
      "sev": "medium",
      "title": "Operator 组件高危姿态：{comp_name}",
      "detail": "Declarative probe assertion (baseline migrated from the module rule).",
      "evidence": "{{steps.snapshot.path}}",
      "mapping": "spec 5.2 网络架构模块 + 5.6 主机网络层；组合签名 hardware-route-privileged-posture / nvl-dra-imex-domain",
      "fix": ""
    },
    {
      "id": "f3",
      "when": "steps.snapshot.exists == true",
      "sev": "medium",
      "title": "GPU/网络 Operator 权限姿态总览",
      "detail": "Declarative probe assertion (baseline migrated from the module rule).",
      "evidence": "{{steps.snapshot.path}}",
      "mapping": "spec 5.2 网络架构模块 + 5.6 主机网络层；组合签名 hardware-route-privileged-posture / nvl-dra-imex-domain",
      "fix": ""
    },
    {
      "id": "f4",
      "when": "steps.snapshot.exists == true",
      "sev": "info",
      "title": "未检测到 GPU/网络 Operator 组件",
      "detail": "Declarative probe assertion (baseline migrated from the module rule).",
      "evidence": "{{steps.snapshot.path}}",
      "mapping": "spec 5.2 网络架构模块 + 5.6 主机网络层；组合签名 hardware-route-privileged-posture / nvl-dra-imex-domain",
      "fix": ""
    }
  ],
  "artifacts": [
    {
      "name": "gpu-network-operator-posture-probe.json",
      "from": "steps",
      "kind": "json"
    }
  ],
  "payloads": {
    "benign": {
      "marker": "INKBLADE-BENIGN",
      "note": "no exploit payload"
    }
  },
  "limits": {
    "timeout_ms": 60000,
    "max_http_requests": 64
  }
}
