{
  "schema": "inkblade-probe-template-v1",
  "key": "rl-rollout-buffer-poison",
  "version": "1.0.0",
  "meta": {
    "name": {
      "zh": "RL 回放缓冲跨租户投毒",
      "en": "RL rollout buffer poisoning"
    },
    "series": "横向利用",
    "min_level": "利用验证",
    "writes": true,
    "requires": [],
    "surfaces": [],
    "cves": [],
    "fidelity": "reduced"
  },
  "inputs": {
    "target": {
      "from": "params.target",
      "required": true,
      "description": "Target base URL"
    }
  },
  "defaults": {
    "timeout_ms": 8000,
    "tls_verify": false
  },
  "steps": [
    {
      "id": "surface",
      "op": "http",
      "method": "GET",
      "url": "{{input.target}}/healthz",
      "save": "surface",
      "allow_failure": true,
      "timeout_ms": 8000
    }
  ],
  "checks": [
    {
      "id": "surface-reachable",
      "when": "steps.surface.status != null",
      "message": "target did not answer the surface probe"
    }
  ],
  "findings": [
    {
      "id": "f1",
      "when": "steps.surface.ok == true",
      "sev": "high",
      "title": "RL 回放缓冲跨租户投毒：tenant-a 改写 tenant-b 轨迹并读回（共享缓冲无隔离）",
      "detail": "Declarative probe assertion (baseline migrated from the module rule).",
      "evidence": "{{steps.snapshot.path}}",
      "mapping": "docs/PRETRAIN-SFT-RL-COVERAGE.md 第 7 节：轨迹/回放缓冲跨租户与篡改；ms-swift rollout agent_loop 与 TRL AsyncGRPO 快照",
      "fix": ""
    },
    {
      "id": "f2",
      "when": "steps.surface.ok == true",
      "sev": "info",
      "title": "回放缓冲写面被拒绝或未形成跨租户读写（投毒未成立）",
      "detail": "Declarative probe assertion (baseline migrated from the module rule).",
      "evidence": "{{steps.snapshot.path}}",
      "mapping": "docs/PRETRAIN-SFT-RL-COVERAGE.md 第 7 节：轨迹/回放缓冲跨租户与篡改；ms-swift rollout agent_loop 与 TRL AsyncGRPO 快照",
      "fix": ""
    },
    {
      "id": "f3",
      "when": "steps.surface.ok == true",
      "sev": "info",
      "title": "回放缓冲统计指纹（probe-only，不触碰写面）",
      "detail": "Declarative probe assertion (baseline migrated from the module rule).",
      "evidence": "{{steps.snapshot.path}}",
      "mapping": "docs/PRETRAIN-SFT-RL-COVERAGE.md 第 7 节：轨迹/回放缓冲跨租户与篡改；ms-swift rollout agent_loop 与 TRL AsyncGRPO 快照",
      "fix": ""
    }
  ],
  "artifacts": [
    {
      "name": "rl-rollout-buffer-poison-probe.json",
      "from": "steps",
      "kind": "json"
    }
  ],
  "payloads": {
    "benign": {
      "marker": "INKBLADE-BENIGN",
      "note": "no exploit payload"
    },
    "attack": {
      "marker": "{{ctx.marker}}",
      "note": "write-surface demo; requires backup receipt"
    }
  },
  "limits": {
    "timeout_ms": 60000,
    "max_http_requests": 64
  },
  "modes": {
    "probe_only": true,
    "backup_write": true,
    "requires_backup": true
  }
}
