{
  "schema": "inkblade-probe-template-v1",
  "key": "runtime-socket-escape",
  "version": "1.0.0",
  "meta": {
    "name": {
      "zh": "容器运行时 Socket 逃逸",
      "en": "Runtime Socket Escape"
    },
    "series": "权限链",
    "min_level": "利用验证",
    "writes": true,
    "requires": [],
    "surfaces": [],
    "cves": [],
    "fidelity": "reduced"
  },
  "inputs": {
    "fixture": {
      "from": "params.fixture",
      "required": true,
      "description": "Collected snapshot / fixture path"
    }
  },
  "defaults": {
    "timeout_ms": 8000,
    "tls_verify": false
  },
  "steps": [
    {
      "id": "snapshot",
      "op": "fs",
      "action": "read",
      "path": "{{input.fixture}}",
      "json": true,
      "save": "snapshot",
      "allow_failure": false
    }
  ],
  "checks": [
    {
      "id": "snapshot-readable",
      "when": "steps.snapshot.ok == true",
      "fatal": true,
      "message": "snapshot is not readable JSON"
    }
  ],
  "findings": [
    {
      "id": "f1",
      "when": "steps.snapshot.exists == true",
      "sev": "high",
      "title": "title",
      "detail": "Declarative probe assertion (baseline migrated from the module rule).",
      "evidence": "{{steps.snapshot.path}}",
      "mapping": "设计基线第 11 节：运行时 socket 挂载逃逸（docker.sock/containerd.sock → 宿主特权容器）",
      "fix": ""
    },
    {
      "id": "f2",
      "when": "steps.snapshot.exists == true",
      "sev": "high",
      "title": "Pod「{name}」挂载容器运行时 socket（宿主逃逸原语）",
      "detail": "Declarative probe assertion (baseline migrated from the module rule).",
      "evidence": "{{steps.snapshot.path}}",
      "mapping": "设计基线第 11 节：运行时 socket 挂载逃逸（docker.sock/containerd.sock → 宿主特权容器）",
      "fix": ""
    },
    {
      "id": "f3",
      "when": "steps.snapshot.exists == true",
      "sev": "high",
      "title": "运行时 socket 逃逸 marker 证明已写入（backup-write + 可回滚）",
      "detail": "Declarative probe assertion (baseline migrated from the module rule).",
      "evidence": "{{steps.snapshot.path}}",
      "mapping": "设计基线第 11 节：运行时 socket 挂载逃逸（docker.sock/containerd.sock → 宿主特权容器）",
      "fix": ""
    }
  ],
  "artifacts": [
    {
      "name": "runtime-socket-escape-probe.json",
      "from": "steps",
      "kind": "json"
    }
  ],
  "payloads": {
    "benign": {
      "marker": "INKBLADE-BENIGN",
      "note": "no exploit payload"
    },
    "attack": {
      "marker": "{{ctx.marker}}",
      "note": "write-surface demo; requires backup receipt"
    }
  },
  "limits": {
    "timeout_ms": 60000,
    "max_http_requests": 64
  },
  "modes": {
    "probe_only": true,
    "backup_write": true,
    "requires_backup": true
  }
}
