{
  "schema": "inkblade-probe-template-v1",
  "key": "post-quantum-tls-posture",
  "version": "1.0.0",
  "meta": {
    "name": {
      "zh": "后量子 TLS 姿态面",
      "en": "Post-quantum TLS posture surface"
    },
    "series": "网络架构",
    "min_level": "主动探测",
    "writes": false,
    "requires": [],
    "surfaces": [],
    "cves": [],
    "fidelity": "reduced"
  },
  "inputs": {
    "target": {
      "from": "params.target",
      "required": true,
      "description": "Target base URL"
    }
  },
  "defaults": {
    "timeout_ms": 8000,
    "tls_verify": false
  },
  "steps": [
    {
      "id": "surface",
      "op": "http",
      "method": "GET",
      "url": "{{input.target}}/healthz",
      "save": "surface",
      "allow_failure": true,
      "timeout_ms": 8000
    }
  ],
  "checks": [
    {
      "id": "surface-reachable",
      "when": "steps.surface.status != null",
      "message": "target did not answer the surface probe"
    }
  ],
  "findings": [
    {
      "id": "f1",
      "when": "steps.surface.ok == true",
      "sev": "high",
      "title": "TLS 使用 RSA 密钥交换或低于 TLS 1.3",
      "detail": "Declarative probe assertion (baseline migrated from the module rule).",
      "evidence": "{{steps.snapshot.path}}",
      "mapping": "docs/CONFERENCE-2026-GAPS.md + docs/INFRA-COVERAGE-2026.md（2026 会议议题核验）",
      "fix": ""
    },
    {
      "id": "f2",
      "when": "steps.surface.ok == true",
      "sev": "high",
      "title": "未配置混合后量子密钥交换",
      "detail": "Declarative probe assertion (baseline migrated from the module rule).",
      "evidence": "{{steps.snapshot.path}}",
      "mapping": "docs/CONFERENCE-2026-GAPS.md + docs/INFRA-COVERAGE-2026.md（2026 会议议题核验）",
      "fix": ""
    },
    {
      "id": "f3",
      "when": "steps.surface.ok == true",
      "sev": "medium",
      "title": "证书或签名算法非后量子",
      "detail": "Declarative probe assertion (baseline migrated from the module rule).",
      "evidence": "{{steps.snapshot.path}}",
      "mapping": "docs/CONFERENCE-2026-GAPS.md + docs/INFRA-COVERAGE-2026.md（2026 会议议题核验）",
      "fix": ""
    },
    {
      "id": "f4",
      "when": "steps.surface.ok == true",
      "sev": "medium",
      "title": "存在 harvest-now-decrypt-later 暴露",
      "detail": "Declarative probe assertion (baseline migrated from the module rule).",
      "evidence": "{{steps.snapshot.path}}",
      "mapping": "docs/CONFERENCE-2026-GAPS.md + docs/INFRA-COVERAGE-2026.md（2026 会议议题核验）",
      "fix": ""
    }
  ],
  "artifacts": [
    {
      "name": "post-quantum-tls-posture-probe.json",
      "from": "steps",
      "kind": "json"
    }
  ],
  "payloads": {
    "benign": {
      "marker": "INKBLADE-BENIGN",
      "note": "no exploit payload"
    }
  },
  "limits": {
    "timeout_ms": 60000,
    "max_http_requests": 64
  }
}
