{
  "schema": "inkblade-probe-template-v1",
  "key": "nvswitch-nvlink-topology",
  "version": "1.0.0",
  "meta": {
    "name": {
      "zh": "NVSwitch/NVLink 拓扑与分区（只读）",
      "en": "NVSwitch/NVLink topology and partitions (read-only)"
    },
    "series": "网络架构",
    "min_level": "只读侦察",
    "writes": false,
    "requires": [],
    "surfaces": [],
    "cves": [],
    "fidelity": "reduced"
  },
  "inputs": {
    "snapshot": {
      "from": "params.snapshot",
      "required": true,
      "description": "Collected snapshot / fixture path"
    }
  },
  "defaults": {
    "timeout_ms": 8000,
    "tls_verify": false
  },
  "steps": [
    {
      "id": "snapshot",
      "op": "fs",
      "action": "read",
      "path": "{{input.snapshot}}",
      "json": true,
      "save": "snapshot",
      "allow_failure": false
    }
  ],
  "checks": [
    {
      "id": "snapshot-readable",
      "when": "steps.snapshot.ok == true",
      "fatal": true,
      "message": "snapshot is not readable JSON"
    }
  ],
  "findings": [
    {
      "id": "f1",
      "when": "steps.snapshot.exists == true",
      "sev": "high",
      "title": "NVLink 分区跨越租户",
      "detail": "Declarative probe assertion (baseline migrated from the module rule).",
      "evidence": "{{steps.snapshot.path}}",
      "mapping": "docs/HARDWARE-SWITCH-COVERAGE.md 三级矩阵 T1；NVIDIA NVLink/NVSwitch、IMEX/ComputeDomain 隔离语义",
      "fix": ""
    },
    {
      "id": "f2",
      "when": "steps.snapshot.exists == true",
      "sev": "medium",
      "title": "NVSwitch 分区共享交换机",
      "detail": "Declarative probe assertion (baseline migrated from the module rule).",
      "evidence": "{{steps.snapshot.path}}",
      "mapping": "docs/HARDWARE-SWITCH-COVERAGE.md 三级矩阵 T1；NVIDIA NVLink/NVSwitch、IMEX/ComputeDomain 隔离语义",
      "fix": ""
    },
    {
      "id": "f3",
      "when": "steps.snapshot.exists == true",
      "sev": "medium",
      "title": "NVSwitch 固件版本不一致",
      "detail": "Declarative probe assertion (baseline migrated from the module rule).",
      "evidence": "{{steps.snapshot.path}}",
      "mapping": "docs/HARDWARE-SWITCH-COVERAGE.md 三级矩阵 T1；NVIDIA NVLink/NVSwitch、IMEX/ComputeDomain 隔离语义",
      "fix": ""
    },
    {
      "id": "f4",
      "when": "steps.snapshot.exists == true",
      "sev": "medium",
      "title": "NVLink 链路非 up",
      "detail": "Declarative probe assertion (baseline migrated from the module rule).",
      "evidence": "{{steps.snapshot.path}}",
      "mapping": "docs/HARDWARE-SWITCH-COVERAGE.md 三级矩阵 T1；NVIDIA NVLink/NVSwitch、IMEX/ComputeDomain 隔离语义",
      "fix": ""
    },
    {
      "id": "f5",
      "when": "steps.snapshot.exists == true",
      "sev": "high",
      "title": "IMEX 通道成员跨租户",
      "detail": "Declarative probe assertion (baseline migrated from the module rule).",
      "evidence": "{{steps.snapshot.path}}",
      "mapping": "docs/HARDWARE-SWITCH-COVERAGE.md 三级矩阵 T1；NVIDIA NVLink/NVSwitch、IMEX/ComputeDomain 隔离语义",
      "fix": ""
    }
  ],
  "artifacts": [
    {
      "name": "nvswitch-nvlink-topology-probe.json",
      "from": "steps",
      "kind": "json"
    }
  ],
  "payloads": {
    "benign": {
      "marker": "INKBLADE-BENIGN",
      "note": "no exploit payload"
    }
  },
  "limits": {
    "timeout_ms": 60000,
    "max_http_requests": 64
  }
}
