{
  "schema": "inkblade-probe-template-v1",
  "key": "overprivileged-sa-escalation",
  "version": "1.0.0",
  "meta": {
    "name": {
      "zh": "宽 ServiceAccount 提权",
      "en": "Overprivileged ServiceAccount Escalation"
    },
    "series": "权限链",
    "min_level": "利用验证",
    "writes": true,
    "requires": [],
    "surfaces": [],
    "cves": [],
    "fidelity": "reduced"
  },
  "inputs": {
    "fixture": {
      "from": "params.fixture",
      "required": true,
      "description": "Collected snapshot / fixture path"
    }
  },
  "defaults": {
    "timeout_ms": 8000,
    "tls_verify": false
  },
  "steps": [
    {
      "id": "snapshot",
      "op": "fs",
      "action": "read",
      "path": "{{input.fixture}}",
      "json": true,
      "save": "snapshot",
      "allow_failure": false
    }
  ],
  "checks": [
    {
      "id": "snapshot-readable",
      "when": "steps.snapshot.ok == true",
      "fatal": true,
      "message": "snapshot is not readable JSON"
    }
  ],
  "findings": [
    {
      "id": "f1",
      "when": "steps.snapshot.exists == true",
      "sev": "high",
      "title": "title",
      "detail": "Declarative probe assertion (baseline migrated from the module rule).",
      "evidence": "{{steps.snapshot.path}}",
      "mapping": "设计基线第 11 节：训练流水线宽 ServiceAccount（can-i 矩阵 → create pods/exec）",
      "fix": ""
    },
    {
      "id": "f2",
      "when": "steps.snapshot.exists == true",
      "sev": "high",
      "title": "ServiceAccount「{subject}」可创建 Pod 与 exec（提权到节点原语齐备）",
      "detail": "Declarative probe assertion (baseline migrated from the module rule).",
      "evidence": "{{steps.snapshot.path}}",
      "mapping": "设计基线第 11 节：训练流水线宽 ServiceAccount（can-i 矩阵 → create pods/exec）",
      "fix": ""
    },
    {
      "id": "f3",
      "when": "steps.snapshot.exists == true",
      "sev": "medium",
      "title": "ServiceAccount「{subject}」存在越权授权项",
      "detail": "Declarative probe assertion (baseline migrated from the module rule).",
      "evidence": "{{steps.snapshot.path}}",
      "mapping": "设计基线第 11 节：训练流水线宽 ServiceAccount（can-i 矩阵 → create pods/exec）",
      "fix": ""
    },
    {
      "id": "f4",
      "when": "steps.snapshot.exists == true",
      "sev": "high",
      "title": "特权 Pod 创建演示已执行（backup-write + 可回滚）",
      "detail": "Declarative probe assertion (baseline migrated from the module rule).",
      "evidence": "{{steps.snapshot.path}}",
      "mapping": "设计基线第 11 节：训练流水线宽 ServiceAccount（can-i 矩阵 → create pods/exec）",
      "fix": ""
    }
  ],
  "artifacts": [
    {
      "name": "overprivileged-sa-escalation-probe.json",
      "from": "steps",
      "kind": "json"
    }
  ],
  "payloads": {
    "benign": {
      "marker": "INKBLADE-BENIGN",
      "note": "no exploit payload"
    },
    "attack": {
      "marker": "{{ctx.marker}}",
      "note": "write-surface demo; requires backup receipt"
    }
  },
  "limits": {
    "timeout_ms": 60000,
    "max_http_requests": 64
  },
  "modes": {
    "probe_only": true,
    "backup_write": true,
    "requires_backup": true
  }
}
