{
  "schema": "inkblade-probe-template-v1",
  "key": "observability-exposure",
  "version": "1.0.0",
  "meta": {
    "name": {
      "zh": "观测面暴露测绘",
      "en": "Observability exposure"
    },
    "series": "侦察",
    "min_level": "只读侦察",
    "writes": false,
    "requires": [],
    "surfaces": [],
    "cves": [],
    "fidelity": "reduced"
  },
  "inputs": {
    "snapshot": {
      "from": "params.snapshot",
      "required": true,
      "description": "Collected snapshot / fixture path"
    }
  },
  "defaults": {
    "timeout_ms": 8000,
    "tls_verify": false
  },
  "steps": [
    {
      "id": "snapshot",
      "op": "fs",
      "action": "read",
      "path": "{{input.snapshot}}",
      "json": true,
      "save": "snapshot",
      "allow_failure": false
    }
  ],
  "checks": [
    {
      "id": "snapshot-readable",
      "when": "steps.snapshot.ok == true",
      "fatal": true,
      "message": "snapshot is not readable JSON"
    }
  ],
  "findings": [
    {
      "id": "f1",
      "when": "steps.snapshot.exists == true",
      "sev": "high",
      "title": "{typ} 直接对外暴露",
      "detail": "Declarative probe assertion (baseline migrated from the module rule).",
      "evidence": "{{steps.snapshot.path}}",
      "mapping": "链「观测面 → 精准打点」：监控/面板暴露 = 资产地图与路径选择器",
      "fix": ""
    },
    {
      "id": "f2",
      "when": "steps.snapshot.exists == true",
      "sev": "medium",
      "title": "经 Ingress {host} 暴露",
      "detail": "Declarative probe assertion (baseline migrated from the module rule).",
      "evidence": "{{steps.snapshot.path}}",
      "mapping": "链「观测面 → 精准打点」：监控/面板暴露 = 资产地图与路径选择器",
      "fix": ""
    },
    {
      "id": "f3",
      "when": "steps.snapshot.exists == true",
      "sev": "info",
      "title": "ClusterIP 集群内可达（平网内任意 Pod 可达）",
      "detail": "Declarative probe assertion (baseline migrated from the module rule).",
      "evidence": "{{steps.snapshot.path}}",
      "mapping": "链「观测面 → 精准打点」：监控/面板暴露 = 资产地图与路径选择器",
      "fix": ""
    }
  ],
  "artifacts": [
    {
      "name": "observability-exposure-probe.json",
      "from": "steps",
      "kind": "json"
    }
  ],
  "payloads": {
    "benign": {
      "marker": "INKBLADE-BENIGN",
      "note": "no exploit payload"
    }
  },
  "limits": {
    "timeout_ms": 60000,
    "max_http_requests": 64
  }
}
