{
  "schema": "inkblade-probe-template-v1",
  "key": "dify-snapshot-cross-tenant-theft",
  "version": "1.0.0",
  "meta": {
    "name": {
      "zh": "Dify 赃快照跨租户窃取",
      "en": "Dify snapshot cross-tenant theft"
    },
    "series": "横向利用",
    "min_level": "利用验证",
    "writes": true,
    "requires": [],
    "surfaces": [],
    "cves": [],
    "fidelity": "reduced"
  },
  "inputs": {},
  "defaults": {
    "timeout_ms": 8000,
    "tls_verify": false
  },
  "steps": [
    {
      "id": "host",
      "op": "fs",
      "action": "stat",
      "path": "/",
      "save": "host",
      "allow_failure": true
    }
  ],
  "checks": [
    {
      "id": "host-readable",
      "when": "steps.host.exists == true",
      "message": "probe filesystem is not readable"
    }
  ],
  "findings": [
    {
      "id": "f1",
      "when": "true",
      "sev": "critical",
      "title": "title",
      "detail": "Declarative probe assertion (baseline migrated from the module rule).",
      "evidence": "{{steps.snapshot.path}}",
      "mapping": "零日级漏洞模块（已公开）：智能体平台跨租户快照条目（已公开，细节随模块展示）",
      "fix": ""
    },
    {
      "id": "f2",
      "when": "true",
      "sev": "critical",
      "title": "Dify 赃快照跨租户窃取：跨租户快照物化作业被接受",
      "detail": "Declarative probe assertion (baseline migrated from the module rule).",
      "evidence": "{{steps.snapshot.path}}",
      "mapping": "零日级漏洞模块（已公开）：智能体平台跨租户快照条目（已公开，细节随模块展示）",
      "fix": ""
    }
  ],
  "artifacts": [
    {
      "name": "dify-snapshot-cross-tenant-theft-probe.json",
      "from": "steps",
      "kind": "json"
    }
  ],
  "payloads": {
    "benign": {
      "marker": "INKBLADE-BENIGN",
      "note": "no exploit payload"
    },
    "attack": {
      "marker": "{{ctx.marker}}",
      "note": "write-surface demo; requires backup receipt"
    }
  },
  "limits": {
    "timeout_ms": 60000,
    "max_http_requests": 64
  },
  "modes": {
    "probe_only": true,
    "backup_write": true,
    "requires_backup": true
  }
}
